{
  "$schema": "https://raw.githubusercontent.com/codepic/Codepic.Cli/main/schema/cli/module-manifest/v1/schema.json",
  "name": ".",
  "version": "0.1.0",
  "description": "Root module manifest for the CLI.",
  "install": {
    "instructions": {
      "human": "To install the Codepic CLI, download the latest release from the GitHub repository and follow the setup instructions in the README.md file.",
      "copilot": "Get the files defined in 'include' from the 'source.git' into local repository. Ask the user what to do if there are any conflicts with existing files."
    }
  },
  "include": [
    ".github/instructions/.build.instructions.md",
    ".github/instructions/.instructions.md",
    ".github/instructions/.protocol.alignment.instructions.md",
    ".github/instructions/.tasks.functions.instructions.md",
    ".github/instructions/.tasks.instructions.md",
    ".github/prompts/.new-module.prompt.md",
    "modules/.tasks.functions.ps1",
    "modules/.tasks.ps1",
    "modules/module.manifest.json",
    ".build.ps1",
    "PSScriptAnalyzerSettings.psd1"
  ],
  "exclude": [],
  "source": {
    "git": "https://github.com/codepic/Codepic.Cli.git",
    "tagPrefix": "v"
  }
}
